{
  "document_id": "DOC-2024-003",
  "document_date": "2024-03-10",
  "title": "Image Format Sample",
  "description": "Testing extraction from image files",
  "amount": 750.00,
  "currency": "EUR",
  "sender": {
    "name": "Gamma Ltd",
    "address": "100 European Way, London, UK"
  },
  "recipient": {
    "name": "Alice Johnson"
  }
}
